,p52,n,NOC,Title ,Additional Comments
660,it developer,1,2171,Information systems analysts and consultants ,
661,it manager,1,213,Computer and information systems managers,
662,it programmer,1,2174,Computer programmers and interactive media developers. ,
663,it project coordinator,1,213,Computer and information systems managers,
664,it specialist,1,2171,Information systems analysts and consultants ,
665,it system engeneer,1,2171,Information systems analysts and consultants ,
666,it team lead,1,213,Computer and information systems managers,
667,janitor,1,6733,"Janitors, caretakers and building superintendents ",
668,jardinière horticultriste paysagiste ecologique,1,8432,Nursery and greenhouse workers,
669,jounalier en alimentation,1,7514,Delivery and courier service drivers,"This translation is ""Food Daily"", I am assuming it is meant to say Food Delivery "
670,jounalisme,1,5123,Journalists,
671,journalist,1,5123,Journalists,
672,"journaliste a la pige , retraité",1,5123,Journalists,
673,journeyman ironworker,1,7236,Ironworkers,
674,journeyman welder,1,7237,Welders and related machine operators,
675,laboratory assitant,1,3212,Medical laboratory technicians and pathologist's assistants. ,"""32"" is the starting code for labrotory assistants in a variety of fields. "
676,labour work,1,7611,Construction trades helpers and labourers ,
677,labourer /construction,1,7611,Construction trades helpers and labourers ,
678,"labourer, fish plant worker",1,9463,Fish and seafood plant workers,
679,labourer,1,7611,Construction trades helpers and labourers ,
680,labrador,1,,,
681,landscape consultant,1,2225,Landscape and horticulture technicians and specialists,
682,landscaping,1,2225,Landscape and horticulture technicians and specialists,
683,laser operator,1,7237,Welders and related machine operators,Includes Laser welder operator
684,lawier,1,4112,Lawyers and Quebec Notaries ,
685,lawyer mediator,1,4112,Lawyers and Quebec Notaries ,
686,layout,1,,,
687,legal bookeeper,1,1311,Accounting technicians and bookkeepers,
688,legal translator,1,5125,"Translators, terminologists and interpretors",
689,letter courrier for canada post,1,1512,Letter carriers,
690,librarian,1,5111,Librarians,
691,licensed practical nurse,1,3233,Licensed practical nurses,
692,lobeiste,1,4164,"Social policy researchers, consultants and program officers ","""Lobbyist"" "
693,logger,1,8616,Logging and forestry labourers,
694,logging,1,8616,Logging and forestry labourers,
695,long distance truck driver,1,7511,Transport truck drivers ,
696,lumber industry - mill worker,1,8616,Logging and forestry labourers,
697,machine operator,1,9417,Machining tool Operators ,
698,machinist,1,7231,Machinists and machining and tooling inspectors,
699,magasignier/ventes internes,1,1522,Storekeepers and partspersons,
700,mail carrier,1,1512,Letter carriers,
701,maintenance man in a flour manufacturer,1,7621,Public works and maintenance labourers ,
702,maintenance superintendent - sawmill,1,714,Facility operation and maintenance managers ,
703,maintenance supervisor,1,714,Facility operation and maintenance managers ,
704,management - engineering,1,211,Engineering Managers,
705,management in retail,1,621,Retail and wholsale trade managers ,
706,"management, business owner.",1,621,Retail and wholsale trade managers ,Picked a management sector with a wide range of potential career options
707,manager at a cemetary + night security,1,714,Facility operation and maintenance managers ,
708,manager at a financial services company.,1,122,"Banking, credit and other investment managers ",
709,manager at air canada,1,731,Manager in Transportation ,
710,manager in retail store,1,621,Retail and wholsale trade managers ,
711,manager insurance industry,1,121,"Insurance, Real estate and financial brokerage managers ",
712,manager of a medical clinic,1,311,Managers in Health Care ,
713,manager of operations,1,710,Facility operation and maintenance managers ,
714,"manager, data management company",1,213,Computer and information systems managers,
715,manger of pharmaceutical company,1,621,Retail and wholsale trade managers ,
716,manger residential support,1,4412,"Home Support workers, housekeepers and related occupations. ",
717,manoeuvre spésialisé,1,,,"""Specialized Manouvre"" "
718,marchandiseur,1,6222,Retail and wholesale buyers,
719,marketing,1,1123,"Professional occupations in advertising, marketing and public relations ",
720,marketing and communications,1,1123,"Professional occupations in advertising, marketing and public relations ",
721,marketing director,1,124,"Advertising, marketing and public relations managers",
722,marketing leader,1,124,"Advertising, marketing and public relations managers",
723,marketing manager,1,124,"Advertising, marketing and public relations managers",
724,massage therapist,1,3236,Massage Therapists,
725,massothérapeute,1,3236,Massage Therapists,
726,materials handler,1,7452,Material Handlers,
727,md,1,3112,General Practitioners and family physicians ,
728,mecanicien,1,7321,"Automotive service technicians, truck and bus mechanics and mechanical repairers ",
729,mécanicien,1,7321,"Automotive service technicians, truck and bus mechanics and mechanical repairers ",
730,mecanicien automobile,1,7321,"Automotive service technicians, truck and bus mechanics and mechanical repairers ",
731,"mecanicien,",1,7321,"Automotive service technicians, truck and bus mechanics and mechanical repairers ",
732,mecanien industriel construction,1,7311,Construction millwrights and industrial mechanics,
733,mechanical designer engineering,1,2132,Mechanical Engineers,
734,mechanical technician,1,2232,Mechanical Engineering technologists and technicians ,
735,medecin,1,3112,General practitioners and family physicians ,
736,medical administrator,1,1243,Medical administrative assistants,
737,medical device sales,1,6221,Technical sales specialists - wholesale trade ,
738,medical lad tech,1,3414,Other assisting occupations in support of health services ,Includes Clinical Laboratory technician 
739,medical office assistant,1,1243,Medical administrative assistants,
740,medical office manager,1,311,Managers in Health Care ,
741,medical radiation technologist,1,3215,Medical radiation technologists,
742,medical sales,1,6221,Technical sales specialists - wholesale trade ,
743,medical secretary,1,1414,Receptionist,Includes Medical Receptionist
744,medical technician,1,3219,Other medical technologists and technicians (except dental health) ,
745,member of civil service,1,4168,Program officers unique to government ,
746,mental healthcare program supervisor,1,423,"Managers in social, community and correctional services",
747,merchandiser,1,6222,Retail and wholesale buyers,
748,merchandiser in retail,1,6222,Retail and wholesale buyers,
749,message therapist,1,3236,Massage Therapists,
750,metallurgist,1,2115,Other professional occupations in physical sciences ,Includes metallurgist
751,middle management,1,114,Other administrative services manager,Unsure of which sector this belongs to.. Chose this as it is relevant to the Management Occupations category and covers a wide variety of possible jobs. 
752,mill operator,1,9431,Sawmill machine operators,
753,mill worker,1,8616,Logging and forestry labourers,
754,milwright,1,7311,Construction millwrights and industrial mechanics,
755,miner,1,8231,Underground production and development miners,
756,modular technician,1,9533,Other wood products assemblers and inspectors ,"Job description outlines setting up, maintaining and inspecting work equipment, and operating spaces. Fit the best in this description. Also a search of ""modular"" brought up this job cartegory immediatley. "
757,mortgage broker,1,1114,Other Financial Officers ,
758,municipal government worker,1,4168,Program officers unique to government ,
759,municipal govnt worker,1,4168,Program officers unique to government ,
760,"music teacher, office administrator",1,1221,Administrative Officers,
761,music therapist,1,3144,Other professional occupations in therapy and assessment ,
762,musician/ reator,1,5133,Musicians and singers,
763,national account manager in sales,1,601,Corporate Sales Managers ,
764,négociateur sur les marchés financiers,1,1113,"Securities agents, investment dealers and brokers",
765,non-profit lobbyist,1,4164,"Social policy researchers, consultants and program officers ",
766,nurse practionner,1,3124,Allied primary health practitioners,
767,nurse rn,1,3012,Registered nurses and registered psychiatric nurses,
768,occupational health and safety,1,2263,Inspectors in public and environmental health and occupational healthy and safety ,
769,occupational health and safety team leader,1,112,Human Resources managers,
770,occupational therapist,1,3143,Occupational therapists,
771,ocean technician,1,2212,Geological and mineral technologists and technicians,"includes various ""Hydro"", ""Water"", ""Sea-"" technician roles"
772,office admin,1,1221,Administrative Officers,
773,office administrator,1,1221,Administrative Officers,
774,office managwr,1,114,Other administrative services manager,
775,officemanager/bookkeeper,1,114,Other administrative services manager,
776,offshore crane operator,1,7371,Crane Operators,
777,oil field worker,1,124,Oil and gas well drilling and related workers and services operators ,
778,oilfield operator,1,8412,Oil and gas well drilling and related workers and services operators ,
779,opérateur,1,9411,"Machine operators, mineral and metal processing ",
780,"operateur de machine fixe, decoupage au laser",1,9411,"Machine operators, mineral and metal processing ",Large category that includes a wide variety of different types of stationary machine operators (However there are A LOT of different catefories with different codes this could fit into) 
781,operateur dèextrudeuse,1,9411,"Machine operators, mineral and metal processing ",
782,opérateur machinerie lourde,1,7521,Heavy equipment operators (except Crane) ,
783,operational training specialist,1,1121,Human Resources professionals ,Includes a variety of training specialists/technicians/consultatns
784,operations cordinator,1,714,Facility operation and maintenance managers ,
785,operations management,1,714,Facility operation and maintenance managers ,
786,opticienne,1,3231,Opticians,
787,ordained minister of evangelical lutheran church in canada,1,4154,Professional occupations in religion  ,
788,organic farmer,1,821,Managers in Agriculture,
789,ouvrier de production dans une usine de maison pré-fabriquée,1,9619,"Other labourers in processing, manufacturing and utilitires ",
790,owner,1,125,Other business services Managers,
791,packaging technician,1,9619,"Other labourers in processing, manufacturing and utilitires ",
792,painter / artist,1,5136,"Painters, sculptors and other visual artists ",
793,painting,1,7611,Construction trades helpers and labourers ,
794,palfrenier,1,8431,General Farm Workers ,Includes Stable Hands 
795,papetier,1,621,Retail and wholesale trade managers ,"a ""stationer"" is someone who manages the sell of stationary materials (According to Google) "
796,paramédic,1,3234,Paramedical occupations ,
797,part time office worker,1,1411,General office support workers,
798,"part time student, part time sales associate",1,6421,Retail salespersons ,
799,parts advisor for car dealership,1,1522,Storekeepers and partspersons ,
800,payment officer,1,1422,Data entry clerks ,"Sounds like a ""payment entry clerk"""
801,payroll administrator,1,1432,Payroll administrator,
802,peace officer - rcmp,1,4311,Police Officers,
803,peintre,1,5136,"Painters, sculptors and other visual artists ",
804,pharmacist,1,3131,Pharmacists,
805,photographe,1,5221,Photographers,
806,physiotherapist,1,3142,Physiotherapist,
807,physiotherapy assistant,1,3237,Other technical occupations in therapy and assessment ,
808,physique,1,3142,Physiotherapist,"""Physical Therapist? "
809,piper fitter super attendant,1,7252,"Steamfitters, pipefitters and sprinkler system installers",
810,plane operator,1,2271,"Air pilots, flight engineers and flying instructors ","ALSO, this kind of sounds like ""planer operator"" (Plane operator is just a weird way of saying pilot… So it also could be 9417 - Machining tool operators"
811,planificateur de réseaux extérieurs en télécommunication,1,211,Engineering Managers,
812,planning and project manager,1,711,Construction managers,
813,plant implementation manager,1,911,Manufacturing managers,
814,plombier,1,7251,Plumber,
815,plumber,1,7251,Plumber,
816,plumber - self employed,1,7251,Plumber,
817,plumber pipe fitter,1,7251,Plumber,
818,police,1,4311,Police Officers,
819,policier ðÿ‘®,1,4311,Police Officers,
820,"policy adviser, public administration",1,4164,"Social Policy researchers, consultants and program officers ",
821,policy analyst,1,4164,"Social Policy researchers, consultants and program officers ",
822,porfessor associates = university,1,4011,University professors and lecturers,
823,portfolio manager,1,1112,Financial and investment analysts,
824,post secondary education,1,,,
825,postal clerk,1,1511,"Mail, postal and related workers ",
826,potato farmer,1,821,Managers in agriculture,
827,pour le ménage,1,,,
828,power engineer,1,2133,Electrical and electronics engineers,
829,power lineman,1,7244,Electrical power line and cable workers,
830,pre-school teacher,1,4214,Early childhood educators and assistants,
831,preneur de son,1,5225,Audio and video recording technicians ,
832,prépose ã  l'entretien ménager,1,4412,"Home support workers, housekeepers and related occupations. ",
833,préposé aux bénificiaires,1,4412,"Home support workers, housekeepers and related occupations. ","a ""Beneficiary Attendant"" is similar to a ""Personal Care Attendant"" or ""PSW"" "
834,preposé d'entretien,1,6733,"Janitors, caretakers and building superintendents ",
835,préposé en entretien ménager,1,4412,"Home support workers, housekeepers and related occupations. ",
836,prepose hygiene salubrite hopital,1,6731,Light duty Cleaners,Includes Hospital cleaners
837,preposée aux beneficiaires,1,4412,"Home support workers, housekeepers and related occupations. ",
838,préposée aux bénéficiaires,1,4412,"Home support workers, housekeepers and related occupations. ",
839,préposée aux personnes agées,1,4412,"Home support workers, housekeepers and related occupations. ",
840,president and coo,1,13,"Senior Managers - financial, communications and other business services",
841,primary support staff with community living,1,4412,"Home support workers, housekeepers and related occupations. ",
842,private contractor,1,7205,"Contractors and supervisors, other construction trades installers, repairers and servicers",
843,process safety manager,1,2263,Inspectors in public and environmental health and occupational healthy and safety ,
844,process server deliver document for the court,1,1251,"Court reporters, medical transcriptionists and related occupations ",
845,procurement sales,1,1225,purchasing agents and officers,
846,product manager,1,601,Corporate sales managers ,Includes product manager
847,producteur agricole,1,8252,"Agricultureal service contractors, farm supervisors and specialized livestock workers",
848,production manager,1,911,Manufacturing managers,
849,professeur,1,4011,University professors and lecturers,
850,professeur d'université,1,4011,University professors and lecturers,
851,professeure université,1,4011,University professors and lecturers,
852,professional accountant,1,1111,Financial auditors and Accountants,
853,professional driver,1,7513,Taxi and limousine drivers and chauffeurs. ,
854,professional engineer,1,2131,Civil Engineers,
855,professional services,1,1122,Professional occupations in business management consulting ,
856,professionnel,1,1122,Professional occupations in business management consulting ,
857,professsional,1,1122,Professional occupations in business management consulting ,
858,program assistant,1,4413,Elementary and secondary school teacher assistants,Includes program assistants in the education sector
859,program coordinator,1,1221,Administrative Officers,
860,program coordinator - refugee/immigration,1,4168,Program officers unique to government ,
861,program facilitator at a family resource centre,1,4212,Social and commiunity service workers,
862,programmer,1,2174,Computer programmers and interactive media developers. ,
863,programmeur analyste en géomatique,1,2255,Technical occupations in geomatics and meteorology ,
864,programmeur machine outils,1,2233,Industrial engineering and manufacturing technologists and technicians ,
865,project coordinator,1,711,Construction managers,
866,project coordinator for consulting firm,1,2171,Information systems analysts and consultants ,
867,property manager,1,714,Facility operation and maintenance managers ,
868,propriétaire d'entreprise,1,125,Other business services managers ,
869,provincial govt,1,4168,Program officers unique to government ,
870,psychologue en pratique privée,1,4151,Psychologists,
871,"psychotherapist, high school teacher",1,4151,Psychologists,
872,public,1,4168,program officers unique to government ,
873,public sector administration,1,1221,Administrative Officers,
874,public servant (provincial),1,4168,program officers unique to government ,
875,publicitaire,1,1123,"Professional occupations in advertising, marketing and public relations ",
876,puppetier - do puppet shows,1,5232,"Other performers, n.e.c.",
877,quality assurance manager,1,2233,Industrial engineering and manufacturing technologists and technicians ,Includes quality assurance technologist 
878,quality laboratory affairs manager,1,212,Architecture and science managers ,Includes laboratory managers
879,r&d - software development engineer,1,2173,Computer programmers and interactive media developers. ,
880,radio technologist,1,3215,Medical radiation technologists,"Im assuming this is referring to ""radiologist"" and not radio broadcasting "
881,radiology technologist,1,3215,Medical radiation technologists,
882,rancher,1,821,Managers in agriculture,
883,rcaf,1,4313,Non-commissioned ranks of the Canadian Forces,Royal Canadian Airforce 
884,rcmp,1,4311,Police Officers,
885,real estate,1,6232,Real estate agents and salespersons ,
886,real estate agent,1,6232,Real estate agents and salespersons ,
887,real estate assessor,1,1314,"Assessors, valuators and appraisors ",
888,real estate broker,1,6232,Real estate agents and salespersons ,
889,real estate developer,1,121,"Insurance, real estate and financial brokerage managers ",
890,real estate development,1,121,"Insurance, real estate and financial brokerage managers ",
891,real estate development manager,1,121,"Insurance, real estate and financial brokerage managers ",
892,real estate sales,1,6232,Real estate agents and salespersons ,
893,real estate sales rep.,1,6232,Real estate agents and salespersons ,
894,reciver,1,1521,Shippers and receivers,
895,refrigeration worker,1,7332,Appliance servicers and repairers ,
896,regional manager,1,601,Corporate sales managers ,
897,regional sales manager,1,601,Corporate sales managers ,
898,registered nurse and a oyster-fisherman as well,1,3012,Registered nurses and registered psychiatric nurses,
899,registered practical nurse,1,3012,Registered nurses and registered psychiatric nurses,
900,registrer,1,,,
901,remote survey interviewer,1,1454,Survey interviewers and statistical clerks,
902,renovateur apres sinistre,1,712,Home building and renovation managers,
903,report writer,1,5123,Journalists,
904,représentant,1,6552,Other customer and information services representatives ,
905,représentant d'agence,1,6552,Other customer and information services representatives ,
906,représentant medical,1,3414,Other assisting occupations in support of health services ,
907,"représentante pour une compagnie d,assurance",1,1312,Insurance adjusters and claims examiners,
908,représentante service client,1,6552,Other customer and information services representatives ,
909,research assistant,1,4012,Post-secondary teaching and research assistants,
910,resident attendant,1,4412,"Home support workers, housekeepers and related occupations. ",
911,resident physician,1,3112,General Practitioners and family physicians ,
912,residential support worker,1,4412,"Home support workers, housekeepers and related occupations. ",
913,resource management,1,2223,Forestry technologists and technicians ,
914,respiratory therapist,1,3214,"Respiratory therapists, clinical perfusionists and cardipulmonary technologists",
915,responsable de service de garde en milieu familial subventionné,1,4412,Home childcare providers,
916,ressource humaine,1,1121,Human Resources professionals ,
917,ressources humaines,1,1121,Human Resources professionals ,
918,restoration sales specialist,1,6411,Sales and account representatives - wholesale trade (non-technical) ,
919,retail - warehouse,1,6421,Retail salesperson,
920,retail and student,1,6421,Retail salesperson,
921,retail clerk,1,6421,Retail salesperson,
922,retail management,1,621,Retail and wholesale trade managers,
923,retail manager,1,621,Retail and wholesale trade managers,
924,retail sales,1,6421,Retail salesperson,
925,retail sales manager,1,621,Retail and wholesale trade managers,
926,retail store manager,1,621,Retail and wholesale trade managers,
927,retial,1,6421,Retail salesperson,
928,retired and investor,1,122,"Banking, credit and other investment managers ",
929,retired and working,1,,,
930,retired builder,1,712,Home building and renovation managers,
931,"retired but currently working full time in customer service, home improvement and telecommunications",1,6421,Retail salespersons ,
932,retired but teaching part time.,1,4032,Elementary school and kindergarten teachers,
933,retired contractor,1,7205,"Contractors and supervisors, other construction trades installers, repairers and servicers",
934,retired educator,1,4032,Elementary school and kindergarten teachers,
935,retired law clerk,1,4211,Paralegal and related occupations ,
936,retired lawyer,1,4112,Lawyers and Quebec Notaries,
937,retired military,1,4313,Non-commissioned ranks of the Canadian Armed Forces,
938,retired school principal,1,422,School principals and administrators of elementary and secondary education. ,
939,retired teacher,1,4032,Elementary school and kindergarten teachers,
940,"retired, casual worker",1,,,
941,"retired, farming, and par-time rural mail delivery",1,1512,Letter carriers,Includes rural mail carrier
942,"retired, now consulting in it.",1,2171,Information systems analysts and consultants ,
943,"retired, teaching in 2nd career",1,4032,Elementary school and kindergarten teachers,
944,retired.,1,,,
945,retired/consulting,1,125,Other business services managers,
946,retired4,1,,,
947,retraite,1,,,
948,retraité/ chauffeur,1,7513,Taxi and limousine drivers and chauffeurs. ,
949,risk analyst,1,1112,Financial and investment analysts,
950,rtf  (ressources de type familiale),1,4212,Social and community service workers ,
951,"run an onlie company, i m president of that company",1,125,Other business services managers,
952,rv tech,1,9226,"Supervisors, other mechanical and metal products manufacturing ",
953,safety professional,1,2263,Inspectors in public and environmental health and occupational healthy and safety ,
954,sales (agricultural),1,6221,Technical sales specialists - wholesale trade ,
955,sales associate,1,6421,Retail salespersons,
956,sales engineer,1,6221,Technical sales specialists - wholesale trade ,
957,sales manager,1,621,Retail and wholesale trade managers,
958,sales of electrical products,1,6221,Technical sales specialists - wholesale trade ,
959,sales person,1,6421,Retail salespersons,
960,sales postion,1,6421,Retail salespersons,
961,sales rep & musician,1,6421,Retail salespersons,
962,sales representatives,1,6421,Retail salespersons,
963,sales worker at ikea,1,6421,Retail salespersons,
964,salesman,1,6421,Retail salespersons,
965,salesperson,1,6421,Retail salespersons,
966,salesperson - sales manager/wholesaler for a liquour company,1,6421,Retail salespersons,
967,scheduler at a university,1,1221,Administrative Officers,
968,school,1,,,
969,school receptionist,1,1241,Administrative Assistants,Includes School Secretary 
970,screening officer,1,6541,Security guards and related security service occupations ,
971,seafood worker,1,9463,Fish and seafood plant workers,
972,secrétaire administrative,1,1241,Administrative assistants,
973,secrétaire comptable,1,1311,Accounting technicians and bookkeepers,
974,secteur manufacturier,1,9619,"Other labourers in processing, manufacturing and utilitires ",
975,security consultant,1,6541,Security guards and related security service occupations ,
976,security guard.,1,6541,Security guards and related security service occupations ,
977,security manager,1,6541,Security guards and related security service occupations ,
978,security officer,1,6541,Security guards and related security service occupations ,
979,self employed - farm/agriculture specialist,1,2123,"Agriculture representatives, consultants and specialists",
980,"self employed - human resources, training &development",1,1121,Human resources professionals ,
981,self employed - management and small business owner,1,125,Other business services managers,
982,self employed - tv and media - co-owner of a tv channel,1,512,"Managers - Publishing, motion pictures, broadcasting and performing arts ",
983,self employed bookkeeper,1,1311,Accounting technicians and bookkeepers,
984,self employed healthcare provider,1,3124,Allied primary health practitioners,
985,self employed in human resources,1,1121,Human resources professionals ,
