,p52,n,NOC,Title ,Additional Comments
986,self employed minister,1,4154,Professional occupations in religion ,
987,self employed programmer,1,2174,Computer programmers and interactive media developers. ,
988,self employeed - steam cleaning,1,6732,Specialized Cleaners,
989,self-employed (arts),1,5136,"Painters, sculptors and other visual artists ",
990,self-employed and university research assistant,1,4012,Post-secondary teaching and research assistants,
991,"self-employed, general contractor",1,711,Construction Managers,
992,selfemploed,1,,,
993,semi - retired and drive a cab,1,7513,taxi and limousine drivers and chauffeurs. ,
994,semi retired teacher,1,4032,Elementary school and kindergarten teachers,
995,semi-retired: work a very few hours part-time and do volunteer work.,1,,,
996,senior director of finance,1,13,"Senior managers - financial, communications and other business services",
997,senior management in advertising,1,124,"Advertising, marketing and public relations managers",
998,"senior manager, marketing communications",1,124,"Advertising, marketing and public relations managers",
999,senior policy analyst,1,1121,Human resources Professionals ,Includes policy analysts
1000,senior project manager,1,711,Construction Managers,
1001,senior project manager of international development projects,1,4163,Business development officers and marketing researchers and consultants ,
1002,server at a restaurant,1,6513,Food and beverage servers ,
1003,service industry,1,6552,Other customer and information services representatives ,
1004,service technician,1,7445,Other repairers and servicers,
1005,services financiers,1,6235,Financial sales representatives ,
1006,settlement worker and linc instructor,1,4212,Social and community service workers ,
1007,ship's captain,1,731,Managers in transportation ,
1008,shipyard,1,7612,Other trades helpers and labourers,
1009,shop supervisor,1,7301,"Contractors and supervisors, mechanic trades ",includes shop supervisor 
1010,sign language interpreter,1,5125,"Translators, terminologists and interpretors",
1011,signaleur routier,1,7611,Construction trades helpers and labourers ,
1012,skilled trade/manufacturing,1,9619,"Other labourers in processing, manufacturing and utilitires ",
1013,small business owners .(body removers),1,4165,"Health policy researchers, consultants and program officers ",Includes Coroners (who are responsible for body removal?) 
1014,social housing,1,4164,"Social policy researchers, consultants and program officers ",
1015,social work,1,4152,Social workers ,
1016,social work/counsellor,1,4152,Social workers ,
1017,social worker & operate a small business,1,4152,Social workers ,
1018,software,1,2174,Computer programmers and interactive media developers. ,
1019,software developper,1,2174,Computer programmers and interactive media developers. ,
1020,software product manager,1,213,Computer and information systems managers,
1021,software tester,1,2283,Information systems testing technicians ,
1022,sofware developper,1,2174,Computer programmers and interactive media developers,
1023,special education assistant,1,4215,Instructors of persons with disabiltiies ,
1024,special needs on school bus,1,7512,"Bus drivers, subway operators and other transit operators. ",
1025,spécialiste contrôle qualité,1,2233,Industrial engineering and manufacturing technologists and technicians ,
1026,speech and language pathologist,1,3141,Audiologists and speech-language pathologists,
1027,sports retail owner,1,621,Retail and wholsale trade managers ,
1028,sr. b2b inside sales,1,6221,Technical sales specialists - wholesale trade ,
1029,stage hand,1,5227,"Support occupations in motion pictures, broadcasting, photography and the performing arts ",
1030,station attendant,1,6621,Service station attendants ,
1031,stay at home dad,1,,,
1032,stay at home mom/rancher,1,821,Managers in agriculture ,
1033,steelworker,1,7201,"Contractors and supervisors, maching, metal forming, shaping and erecting trades and related occupations ",
1034,stevador,1,7533,Boat and cable ferry operators and related occupations ,a Stevador works on the docks loading and unloading cargo 
1035,store clerk,1,1522,Storekeepers and partspersons ,
1036,student (university undergraduate),1,,,
1037,student and care aid,1,4412,"Homre support workers, housekeepers and related occupations ",Personal Care attendant 
1038,student and federal employee,1,4168,Program officers unique to government ,
1039,student federal employee,1,4168,Program officers unique to government ,
1040,student full time working part time in an hospital,1,3414,Other assisting occupations in support of health services ,
1041,student marker,1,4012,Post-secondary teaching and research assistants,
1042,student teacher,1,4012,Post-secondary teaching and research assistants,
1043,student that works,1,,,
1044,"student, however, i work with the federal government part time",1,4168,Program officers unique to government ,
1045,"student, youth care worker",1,4212,Social and community service workers ,
1046,student/ part time worker,1,,,
1047,student/junior policy analyst,1,4164,"Social policy researchers, consultants and program officers",
1048,superviseur des opérations,1,1211,"Supervisors, general office and administrative support workers ",includes operations supervisors
1049,superviseur ville de laval,1,411,Government managers - health and social policy development and program administration ,
1050,supervisor for heavy civil construction,1,7302,"Cotractos and supervisors, heavy equipment operator crews",
1051,supervisor maintenance,1,6315,Cleaning Supervisors,
1052,suppléante enseignement primaire,1,4032,Elementary school and kindergarten teachers,
1053,supply technician for the military,1,4313,Non-commissioned ranks of the Canadian Armed Forces,
1054,surgeon,1,3111,Speicialist physicians ,
1055,surintendant,1,6733,"Janitors, caretakers and building superintendents ",
1056,surintendant aux opérations,1,6733,"Janitors, caretakers and building superintendents ",
1057,survey engineer,1,2131,Civil engineers,
1058,systems engineer,1,2131,Civil engineers,
1059,systems manager,1,213,Computer and information systems managers,
1060,taper,1,7284,"Plasterers, drywall installers and finishers and lathers",
1061,tax auditor,1,1111,Financial auditors and Accountants,
1062,"taxi driver, full time and english tutor, part-time",1,7513,taxi and limousine drivers and chauffeurs. ,
1063,teacher - elementary and secondary,1,4032,Elementary school and kindergarten teachers,
1064,teacher (private),1,4032,Elementary school and kindergarten teachers,
1065,teacher catholic,1,4032,Elementary school and kindergarten teachers,
1066,teacher's aid,1,4413,elementary and secondary school teacher assistants,
1067,teacher's assistant and homemaker,1,4413,elementary and secondary school teacher assistants,
1068,teaching,1,4032,Elementary school and kindergarten teachers,
1069,teaching children programming codes,1,4032,Elementary school and kindergarten teachers,
1070,tech startup,1,213,Computer and information systems managers,
1071,technical analyst,1,2171,Information systems analysts and consultants ,
1072,technical engineer,1,2131,Civil Engineers,
1073,technician technology,1,2283,Information systems testing technicians ,
1074,technicien ã  la fabrication de c'blage,1,2242,Electronic service technicians (housegold and business equipment) ,
1075,technicien comptable,1,1311,Accounting technicians and bookkeepers,
1076,technicien en génie civile,1,2231,Civil engineering technologists and technicians ,
1077,technicien en génie électrique,1,2241,Electrical and electronics engineering technologists and technicians ,
1078,technicien en informatique,1,2283,Information systems testing technicians ,
1079,technicien en mécanique,1,7301,"Contractors and supervisors, mechanic trades ",
1080,technicien en mecanique de batiment,1,7301,"Contractors and supervisors, mechanic trades ",
1081,technicien en télécommunication   â«cable guyâ»,1,7244,Electrical power line and cable workers,
1082,technicien en traitement des eaux,1,9243,Water and waste treatments plant operators ,
1083,technicien informatique,1,2283,Information systems testing technicians ,
1084,technicien service en soin de snté,1,3219,Other medical technologists and technicians (except dental health) ,
1085,technicienne en administration réseau de la santé,1,3219,Other medical technologists and technicians (except dental health) ,
1086,technicienne en laboratoire,1,3219,Other medical technologists and technicians (except dental health) ,
1087,technicienne en organisation scolaire,1,4166,"Education policy researchers, consultants and program officers ",Includes various operations and program coordinators 
1088,technicienne en pharmacie,1,3219,Other medical technologists and technicians (except dental health) ,
1089,technicienne en santé animale,1,3213,Animal health technologists and veterinary technicians,
1090,techniciennes en verification,1,2233,Industrial engineering and manufacturing technologists and technicians ,Includes Quality Assurance technologist 
1091,technitien aux travaux pratiques,1,3219,Other medical technologists and technicians (except dental health) ,
1092,technologist télécomunication,1,7202,"Contractors and supervisors, electrical trades and telecommunications occupations ",
1093,technologue en génie biomédical,1,2241,Electrical and electronics engineering technologists and technicians ,
1094,technology,1,2171,Information systems analysts and consultants ,
1095,technology consultant,1,2171,Information systems analysts and consultants ,
1096,telecommunications rigger,1,5227,"Support occupations in motion pictures, broadcasting, photography and the performing arts ","Includes various ""riggers"" "
1097,telecommunications technologist,1,7202,"Contractors and supervisors, electrical trades and telecommunications occupations ",
1098,telephone interviewer - research,1,1454,Survey interviewers and statistical clerks,
1099,textile worker,1,9616,Labourers in textile processing ,
1100,thérapeute en réadaptation physique (temps plein) enseignant collégial (chargé de cours temps partiel),1,3142,Physiotherapists ,
1101,tile setter,1,7611,Construction trades helpers and labourers ,
1102,tim,1,,,
1103,tool and die maker,1,7232,Tool and die makers,
1104,toolmaker,1,7232,Tool and die makers,
1105,trades person,1,7205,"Contractors and supervisors, other construction trades, installers, repairers and services ",
1106,trades trainer,1,4021,college and other vocational instructors ,
1107,tradesman - electrical,1,7202,"Contractors and supervisors, electrical trades and telecommunications occupations ",
1108,tradesman construction,1,7205,"Contractors and supervisors, other construction trades, installers, repairers and services ",
1109,traductrice,1,5125,"Translators, terminologists and interpretors",
1110,trainer for representatives in a call center,1,6314,Customer and information services supervisors,
1111,transportation of foodstuffs,1,7514,Delivery and courier service drivers ,
1112,travail de bureau,1,1411,General office support workers ,
1113,travail de production dans une usine de pate et papier,1,9235,"Pulping, papernaking and coating control operators",
1114,travaille en phsycologie,1,4151,Psychologist,
1115,travailleur autonome,1,,,
1116,travailleur autonome : comptable-fiscaliste,1,1111,financial auditors and Accountants,
1117,travailleur autonome dans le domaine agricole,1,8431,General Farm Workers,
1118,travailleur autonome dans le domaine artistique,1,5136,"Painters, sculptors and other visual artists ",
1119,travailleur autonome dans le domaine événementiel,1,1226,Conference and event planners,
1120,travailleur autonome et aussi avec les enfants,1,,,
1121,travailleur autonome et retraitée du secteur de l'éducation,1,4166,"education policy researchers, consultants and program officers ",
1122,"travailleur autonome, fabrication de bijoux",1,6344,"Jewellers, jewellery and watch repairers and related occupations. ",
1123,travailleur social,1,4152,Social Workers,
1124,"travailleure autonome en administration, comptabilité",1,1111,Financial auditors and Accountants,
1125,travailleuse autonome,1,,,
1126,travailleuse.sociale,1,4152,Social Workers,
1127,truckdriver,1,7511,Transport Truck Drivers ,
1128,trucker,1,7511,Transport Truck Drivers ,
1129,tweed tender,1,6421,Retail salespersons,
1130,underground miner,1,8231,Underground production and development miners,
1131,union representative,1,1121,Human resources professionals ,
1132,union research representative,1,4164,"social policy researchers, consultants and program offices ",
1133,unit clerk in a hospital,1,1252,Health information management occupations ,
1134,university professor,1,4011,University professors and lecturers,
1135,university student,1,,,
1136,university student/security officer,1,6541,Security guards and related security service occupations ,
1137,utilities,1,9613,Labourers in chemical products processing and utilities ,
1138,vendeuse,1,6221,Technical sales specialists - wholesale trade ,
1139,vendeuse dans un commerce,1,6221,Technical sales specialists - wholesale trade ,
1140,vente au details,1,6421,Retail salespersons,
1141,verificatrice,1,2233,Industrial engineering and manufacturing technologists and technicians ,
1142,veterinarian,1,3114,Veterinarians,
1143,vice president,1,15,"Senior Managers - trade, broadcasting and other services, n.e.c. ",
1144,vice president contractor,1,15,"Senior Managers - trade, broadcasting and other services, n.e.c. ",
1145,vice president of a coorporation,1,13,"Senior manager -financial, communications and other business services ",
1146,vice president of operations for an international company,1,13,"Senior manager -financial, communications and other business services ",
1147,vice principal,1,422,School principals and administrators of elementary and secondary education. ,
1148,visitor experience coordinator,1,6552,Other customer and information services representatives ,
1149,visual art and communication,1,5136,"Painters, sculptors and other visual artists ",
1150,vp - global operations,1,15,"Senior Managers - trade, broadcasting and other services, n.e.c. ",
1151,warehouse attendant,1,7452,Material handlers,
1152,warehouse manager,1,714,Facility operation and maintenance managers ,
1153,waste water operator,1,9243,Water and waste treatments plant operators ,
1154,welder (entrepreneur),1,7237,Welders and related machine operators,
1155,weldering or trades,1,7237,Welders and related machine operators,
1156,welding/farming,1,7237,Welders and related machine operators,
1157,wild fire,1,4312,Firefighters,
1158,work at home depot,1,6421,Retail salespersons,
1159,work at insurance,1,1312,Insurance adjusters and claims examiners,
1160,work for a bank,1,1434,"Banking, insurance and other financial clerks ",
1161,work for government,1,4168,Program officers unique to government ,
1162,work for population growth office,1,1411,General office support workers ,"Works with records management, filing etc. "
1163,work for the gov't,1,4168,Program officers unique to government ,
1164,work for the government,1,4168,Program officers unique to government ,
1165,work in a welding fabrication shop,1,9612,Labourers in metal fabrication ,
1166,work in customer service,1,6552,Other customer and information services representatives ,
1167,work in health care,1,3414,Other assisting occupations in support of health services ,
1168,work in retail,1,6421,Retail salespersons,
1169,work in the oil industry,1,8412,Oil and gas well drilling and related workers and services operators ,
1170,working at a nursing home- student,1,3414,Other assisting occupations in support of health services ,
1171,works in a grocery store,1,6622,"Store shelf stockers, clerks and order fillers",
1172,writer,1,5121,Authors and writers,
1173,youth care worker,1,4212,Social and community service workers ,
1174,"zomboni driver, shift duty engineer",1,6722,"Operators and attendants in amusement, recreation and sport ",